,Name,Mileage,Address,Rating,Fuel Type,City MPG,Highway MPG,Drivetrain,Engine,Exterior Color,Interior Color,Transmission,Entertainment,Safety,Price
637, 2012 Toyota Sienna LE,"140,758","Tacoma, WA 98409",4.3, Gasoline,17,23, AWD, 3.5L V6 24V MPFI DOHC, Predawn Gray Mica, Light Gray, 6-Speed Automatic,['Bluetooth'],"['Brake Assist', 'Stability Control']","$14,995"
638, 2016 Tesla Model X 90D,"87,893","Tacoma, WA 98409",4.3, Electric,90,94, AWD, Electric, Deep Blue Metallic, Black, 1-Speed Automatic,"['Bluetooth', 'Premium Sound System']","['Backup Camera', 'Brake Assist', 'Stability Control', 'Lane Departure Warning']","$55,995"
639, 2021 Hyundai Sonata Limited,61,"Tacoma, WA 98409",4.2, Gasoline,27,37, FWD, 1.6L I4 16V GDI DOHC Turbo, Phantom Black, Dark Gray, 8-Speed Automatic,"['Bluetooth', 'Premium Sound System']","['Backup Camera', 'Brake Assist', 'Stability Control', 'Automatic Emergency Braking', 'Blind Spot Monitor', 'Rear Cross Traffic Alert']","$30,530"
640, 2021 Hyundai Sonata Limited,9,"Tacoma, WA 98409",4.2, Gasoline,27,37, FWD, 1.6L I4 16V GDI DOHC Turbo, Stormy Sea, Black, 8-Speed Automatic,"['Bluetooth', 'Premium Sound System']","['Backup Camera', 'Brake Assist', 'Stability Control', 'Automatic Emergency Braking', 'Blind Spot Monitor', 'Rear Cross Traffic Alert']","$31,065"
641, 2014 BMW 550 i,"49,988","Fife, WA 98424",4.9, Gasoline,17,25, RWD, Twin Turbo Premium Unleaded V-8 4.4 L/268, Jet Black, Black, Automatic,-1,-1,"$23,800"
642, 2018 Mercedes-Benz C 300,"17,817","Tacoma, WA 98498",3.6, Gasoline,24,33, RWD, Intercooled Turbo Premium Unleaded I-4 2.0 L/121, Black,-1, Automatic,['Bluetooth'],"['Backup Camera', 'Stability Control']","$28,730"
643, 2019 BMW 330 i xDrive,"15,551","Fife, WA 98424",4.8, Gasoline,25,34, AWD, 2.0L I4 16V GDI DOHC Turbo, Alpine White, Mocha, 8-Speed Automatic,['Bluetooth'],"['Backup Camera', 'Brake Assist', 'Stability Control', 'Automatic Emergency Braking']","$35,000"
644, 2018 Lexus ES 350 Base,"32,074","Fife, WA 98424",4.9, Gasoline,21,30, FWD, Regular Unleaded V-6 3.5 L/211, Eminent White Pearl, Stratus Gray w/Linear, Automatic,-1,-1,"$31,600"
645, 2017 INFINITI Q60 Red Sport 400,"15,934","Tacoma, WA 98498",3.6, Gasoline,-1,-1, RWD, Twin Turbo Premium Unleaded V-6 3.0 L/183, Graphite Shadow, Graphite, Automatic,"['Bluetooth', 'Premium Sound System']","['Backup Camera', 'Brake Assist', 'Stability Control']","$35,999"
646, 2017 BMW X5 eDrive xDrive40e,"43,431","Tacoma, WA 98498",3.6, Hybrid,-1,-1, AWD, Intercooled Turbo Gas/Electric I-4 2.0 L/122, Dark Graphite Metallic,-1, Automatic,-1,"['Backup Camera', 'Brake Assist']","$34,980"
647, 2015 Toyota Highlander XLE,"33,317","Puyallup, WA 98371",4.7, Gasoline,19,25, FWD, 3.5L V6 24V MPFI DOHC, Attitude Black Metallic, Almond, 6-Speed Automatic,"['Bluetooth', 'Premium Sound System']","['Backup Camera', 'Brake Assist', 'Stability Control']","$28,850"
648, 2019 Honda Civic LX,"13,747","Puyallup, WA 98371",4.9, Gasoline,30,38, FWD, 2.0L I4 16V MPFI DOHC, Red, Black, Automatic CVT,['Bluetooth'],"['Backup Camera', 'Brake Assist', 'Stability Control', 'Automatic Emergency Braking', 'Lane Departure Warning']","$19,999"
649, 2020 Mazda CX-30 Select,"4,227","Puyallup, WA 98371",4.8, Gasoline,24,31, AWD, 2.5L I4 16V GDI DOHC, Snowflake White Pearl, Black, 6-Speed Automatic,"['Bluetooth', 'Apple CarPlay/Android Auto']","['Backup Camera', 'Brake Assist', 'Stability Control', 'Blind Spot Monitor', 'Lane Departure Warning', 'Rear Cross Traffic Alert']","$24,149"
650, 2019 Kia Optima LX,"20,175","Federal Way, WA 98003",4.8, Gasoline,24,33, FWD, 2.4L I4 16V GDI DOHC, Sparkling Silver, Black, 6-Speed Automatic,"['Bluetooth', 'Apple CarPlay/Android Auto']","['Backup Camera', 'Brake Assist', 'Stability Control', 'Automatic Emergency Braking', 'Lane Departure Warning', 'Rear Cross Traffic Alert']","$22,491"
651, 2017 Honda Civic EX-T,"38,256","Sumner, WA 98390",4.8, Gasoline,32,42, FWD, 1.5L I4 16V GDI DOHC Turbo, Lunar Silver Metallic, Black, Automatic CVT,"['Bluetooth', 'Apple CarPlay/Android Auto']","['Backup Camera', 'Brake Assist', 'Stability Control']","$19,977"
652, 2018 Hyundai Santa Fe Sport 2.4L,"66,736","Sumner, WA 98390",4.8, Gasoline,21,27, FWD, 2.4L I4 16V GDI DOHC, Platinum Graphite, Beige, 6-Speed Automatic,['Bluetooth'],"['Backup Camera', 'Brake Assist', 'Stability Control']","$16,444"
653, 2019 Ford Edge Titanium,"24,222","Auburn, WA 98002",4.6, Gasoline,21,28, AWD, 2.0L I4 16V GDI DOHC Turbo, Magnetic Metallic, Ebony, 8-Speed Automatic,"['Bluetooth', 'Premium Sound System', 'Apple CarPlay/Android Auto']","['Brake Assist', 'Stability Control']","$29,500"
654, 2014 Acura TL Technology,"74,235","Auburn, WA 98002",4.6, Gasoline,18,26, AWD, 3.7L V6 24V MPFI SOHC, Bellanova White Pearl, Greystone, 6-Speed Automatic,"['Bluetooth', 'Premium Sound System']","['Brake Assist', 'Stability Control']","$19,000"
655, 2014 Nissan Rogue SL,"65,247","Auburn, WA 98001",5, Gasoline,25,32, AWD, 2.5L I4 16V MPFI DOHC, Super Black, Charcoal, Automatic CVT,"['Bluetooth', 'Premium Sound System']","['Brake Assist', 'Stability Control', 'Blind Spot Monitor', 'Lane Departure Warning']","$16,400"
656, 2018 Subaru Legacy,"32,965","Auburn, WA 98001",5, Gasoline,25,34, AWD, 2.5L H4 16V MPFI DOHC, Crystal Black Silica, Ivory, Automatic CVT,"['Bluetooth', 'Premium Sound System']","['Backup Camera', 'Brake Assist', 'Stability Control', 'Automatic Emergency Braking', 'Lane Departure Warning']","$22,450"
657, 2012 Toyota Prius v Five,"76,763","Auburn, WA 98001",5, Hybrid,44,40, FWD, 1.8L I4 16V MPFI DOHC Hybrid, Blue, Gray, Automatic CVT,['Bluetooth'],"['Backup Camera', 'Brake Assist', 'Stability Control']","$13,300"
658, 2017 Hyundai Elantra Limited,"77,742","Auburn, WA 98002",4.4, Gasoline,28,37, FWD, 2.0L I4 16V MPFI DOHC, Phantom Black, Beige, 6-Speed Automatic,['Bluetooth'],"['Backup Camera', 'Brake Assist', 'Stability Control']","$11,829"
659, 2013 Mercedes-Benz C 300 4MATIC,"72,289","Auburn, WA 98001",5, E85 Flex Fuel,20,27, AWD, 3.5L V6 24V GDI DOHC Flexible Fuel, Silver, Black, 7-Speed Automatic,"['Bluetooth', 'Premium Sound System']","['Brake Assist', 'Stability Control']","$12,950"
660, 2013 Toyota Sienna SE,"25,327","Kent, WA 98032",4.8, Gasoline,18,25, FWD, 3.5L V6 24V MPFI DOHC, Black, Gray, 6-Speed Automatic,['Bluetooth'],"['Backup Camera', 'Brake Assist', 'Stability Control']","$22,500"
661, 2006 Ford F-350 Lariat Super Duty,"217,870","Roy, WA 98580",3.6, Diesel,-1,-1, 4WD, 6.0L V8 32V DDI OHV Turbo Diesel, Gray, Black, 5-Speed Automatic,-1,-1,"$14,995"
662, 2011 Ford F-150 Lariat,"170,555","Roy, WA 98580",3.6, E85 Flex Fuel,14,19, 4WD, 5.0L V8 32V MPFI DOHC Flexible Fuel, Black, Black, 6-Speed Automatic,['Bluetooth'],['Stability Control'],"$14,995"
663, 2012 Jeep Wrangler Unlimited Rubicon,"98,194","Burien, WA 98168",4.8, Gasoline,16,21, 4WD, 3.6L V6 24V MPFI DOHC, Black, Black, 5-Speed Automatic,"['Bluetooth', 'Premium Sound System']","['Brake Assist', 'Stability Control']","$26,949"
664, 2016 Volvo XC90 T6 Momentum,"46,949","Renton, WA 98057",5, Gasoline,20,25, AWD, 2.0L I4 16V GDI DOHC, Black, Tan, 8-Speed Automatic,"['Bluetooth', 'Premium Sound System']","['Brake Assist', 'Stability Control', 'Blind Spot Monitor', 'Lane Departure Warning']","$34,998"
665, 2016 Cadillac Escalade Luxury,"70,367","Renton, WA 98057",5, Gasoline,15,21, 4WD, 6.2L V8 16V GDI OHV, Black, Black, 8-Speed Automatic,"['Bluetooth', 'Rear Seat Entertainment', 'Premium Sound System']","['Brake Assist', 'Stability Control', 'Blind Spot Monitor', 'Lane Departure Warning']","$42,998"
666, 2013 Chevrolet Impala LTZ,"101,063","Port Orchard, WA 98366",4.4, Gasoline,18,30, FWD, 3.6L V6 24V GDI DOHC, Black, Ebony, 6-Speed Automatic,"['Bluetooth', 'Premium Sound System']",['Stability Control'],"$9,900"
667, 2021 Ford Bronco Sport Big Bend,20,"Renton, WA 98057",4.7, Gasoline,25,28, 4WD, 1.5L I3 12V PDI DOHC Turbo, Kodiak Brown Metallic, Medium Dark Slate, 8-Speed Automatic,"['Bluetooth', 'Apple CarPlay/Android Auto']","['Backup Camera', 'Brake Assist', 'Stability Control', 'Automatic Emergency Braking', 'Lane Departure Warning', 'Rear Cross Traffic Alert']","$28,815"
668, 2021 Jeep Cherokee Latitude Plus,9,"Renton, WA 98057",4.3, Gasoline,22,31, 4WD, 2.4L I4, Granite Crystal Metallic Clearcoat, Black, 9-Speed 948TE Automatic,"['Bluetooth', 'Apple CarPlay/Android Auto']","['Backup Camera', 'Brake Assist', 'Stability Control', 'Blind Spot Monitor', 'Lane Departure Warning']","$25,499"
669, 2021 Chevrolet Silverado 1500 RST,5,"Renton, WA 98057",3.8, Diesel,19,22, 4WD, 3.0L I6 24V DDI DOHC Turbo Diesel, Black, Jet Black, Automatic,"['Bluetooth', 'Premium Sound System', 'Apple CarPlay/Android Auto']","['Backup Camera', 'Brake Assist', 'Stability Control', 'Blind Spot Monitor', 'Rear Cross Traffic Alert']","$55,700"
670, 2021 Chrysler 300 S,12,"Renton, WA 98057",4.3, Gasoline,19,30, RWD, HEMI 5.7L V8 Multi Displacement VVT, Granite Crystal Metallic Clearcoat, Black, 8-Speed Automatic,"['Bluetooth', 'Premium Sound System', 'Apple CarPlay/Android Auto']","['Backup Camera', 'Brake Assist', 'Stability Control', 'Blind Spot Monitor', 'Rear Cross Traffic Alert']","$46,525"
671, 2010 Ford Edge Limited,"126,194","Enumclaw, WA 98022",4.7, Gasoline,17,23, AWD, 3.5L V6 24V MPFI DOHC, White Platinum Tri-Coat Metallic, Camel, 6-Speed Automatic,"['Bluetooth', 'Premium Sound System']",['Stability Control'],"$10,999"
672, 2017 Jeep Cherokee Trailhawk,"69,283","Olympia, WA 98502",4.1, Gasoline,19,25, 4WD, 2.4L I4 16V MPFI SOHC, Diamond Black, Black, 9-Speed Automatic,['Bluetooth'],"['Backup Camera', 'Brake Assist', 'Stability Control']","$22,498"
673,Certified 2019 Volkswagen Golf SportWagen 1.8T S,"29,286","Olympia, WA 98502",4.8, Gasoline,22,29, AWD, 1.8L I4 16V GDI DOHC Turbo, Silk Blue Metallic, Titan Black, 6-Speed Automatic with Auto-Shift,['Bluetooth'],"['Backup Camera', 'Brake Assist', 'Stability Control']","$19,989"
674, 2021 Nissan Altima 2.5 SL,3,"Olympia, WA 98502",4.8, Gasoline,25,35, AWD, 2.5L I4 16V GDI DOHC, Scarlet Ember, Charcoal, Automatic CVT,"['Bluetooth', 'Premium Sound System', 'Apple CarPlay/Android Auto']","['Backup Camera', 'Brake Assist', 'Stability Control', 'Blind Spot Monitor', 'Lane Departure Warning']","$31,295"
675, 2017 Toyota Corolla iM Base,"26,512","Olympia, WA 98502",4.8, Gasoline,27,35, FWD, 1.8L I4 16V MPFI DOHC, Spring Green, Black, Automatic CVT,"['Bluetooth', 'Premium Sound System']","['Backup Camera', 'Brake Assist', 'Stability Control', 'Lane Departure Warning']","$16,988"
676, 2021 Nissan Altima 2.5 SL,3,"Olympia, WA 98502",4.8, Gasoline,25,35, AWD, 2.5L I4 16V GDI DOHC, Gun Metallic, Charcoal, Automatic CVT,"['Bluetooth', 'Premium Sound System', 'Apple CarPlay/Android Auto']","['Backup Camera', 'Brake Assist', 'Stability Control', 'Automatic Emergency Braking', 'Blind Spot Monitor', 'Lane Departure Warning']","$30,900"
677, 2019 Hyundai Tucson Sport,"9,225","Olympia, WA 98502",4.1, Gasoline,22,28, FWD, 2.4L I4 16V GDI DOHC, Black Noir Pearl, Black, 6-Speed Automatic,"['Bluetooth', 'Premium Sound System', 'Apple CarPlay/Android Auto']","['Backup Camera', 'Brake Assist', 'Stability Control', 'Automatic Emergency Braking', 'Lane Departure Warning', 'Rear Cross Traffic Alert']","$23,998"
678, 2021 BMW M550 i xDrive,23,"Seattle, WA 98134",4.8, Gasoline,17,25, AWD, 4.4L V8 32V GDI DOHC Twin Turbo, Aventurin Red Metallic, Ivory White, 8-Speed Automatic,"['Bluetooth', 'Premium Sound System', 'Apple CarPlay/Android Auto']","['Backup Camera', 'Brake Assist', 'Stability Control', 'Blind Spot Monitor']","$88,145"
679, 2020 Chrysler Pacifica Limited,"22,809","Seattle, WA 98104",1, Gasoline,19,28, FWD, 3.6L V6 24V MPFI DOHC, Brilliant Black Crystal Pearlcoat, Cognac, 9-Speed Automatic,"['Bluetooth', 'Premium Sound System']","['Brake Assist', 'Stability Control']","$34,497"
680, 2017 Chrysler 300C Base,"65,655","Seattle, WA 98101",3.6, Gasoline,19,30, RWD, Regular Unleaded V-6 3.6 L/220, Billet Silver Metallic Clearcoat, Black, Automatic,"['Bluetooth', 'Premium Sound System', 'Apple CarPlay/Android Auto']","['Backup Camera', 'Stability Control']","$17,080"
681, 2016 BMW X3 xDrive28i,"62,149","Seattle, WA 98101",3.6, Gasoline,21,28, AWD, Intercooled Turbo Premium Unleaded I-4 2.0 L/122, Carbon Black Metallic,-1, Automatic,['Bluetooth'],['Backup Camera'],"$20,730"
682, 2017 Audi A6 2.0T Premium Plus,"21,095","Seattle, WA 98101",3.6, Gasoline,-1,-1, AWD, Intercooled Turbo Premium Unleaded I-4 2.0 L/121, Black,-1, Automatic,['Premium Sound System'],"['Backup Camera', 'Brake Assist', 'Stability Control', 'Blind Spot Monitor']","$26,999"
683, 2018 Jeep Grand Cherokee Laredo E,"25,411","Seattle, WA 98101",3.6, Gasoline,-1,-1, 4WD, Regular Unleaded V-6 3.6 L/220, Diamond Black Crystal Pearlcoat, Black, Automatic,"['Bluetooth', 'Apple CarPlay/Android Auto']","['Backup Camera', 'Brake Assist', 'Stability Control']","$26,299"
684, 2018 Nissan Maxima S,"6,975","Seattle, WA 98101",3.6, Gasoline,21,30, FWD, Premium Unleaded V-6 3.5 L/213, Carnelian Red, Charcoal, Variable,"['Bluetooth', 'Premium Sound System', 'Apple CarPlay/Android Auto']","['Backup Camera', 'Brake Assist', 'Stability Control']","$22,399"
685, 2018 Acura RDX FWD w/Tech,"22,258","Seattle, WA 98101",3.6, Gasoline,-1,-1, FWD, Premium Unleaded V-6 3.5 L/212, White Diamond Pearl,-1, Automatic,-1,"['Backup Camera', 'Brake Assist', 'Stability Control', 'Blind Spot Monitor', 'Rear Cross Traffic Alert']","$27,150"
686, 2021 Honda Accord Hybrid EX,10,"Bellevue, WA 98006",4.1, Hybrid,48,48, FWD, 2.0L I4 16V MPFI DOHC Hybrid, Crystal Black Pearl, Black, Automatic CVT,"['Bluetooth', 'Apple CarPlay/Android Auto']","['Backup Camera', 'Brake Assist', 'Stability Control', 'Automatic Emergency Braking', 'Blind Spot Monitor', 'Lane Departure Warning', 'Rear Cross Traffic Alert']","$29,869"
687, 2021 Honda Accord Hybrid EX,8,"Bellevue, WA 98006",4.1, Hybrid,48,48, FWD, 2.0L I4 16V MPFI DOHC Hybrid, Crystal Black Pearl, Black, Automatic CVT,"['Bluetooth', 'Apple CarPlay/Android Auto']","['Backup Camera', 'Brake Assist', 'Stability Control', 'Automatic Emergency Braking', 'Blind Spot Monitor', 'Lane Departure Warning', 'Rear Cross Traffic Alert']","$31,015"
688, 2021 Honda Pilot Special Edition,489,"Bellevue, WA 98006",4.1, Gasoline,19,26, AWD, 3.5L V6 24V GDI SOHC, Steel Sapphire Metallic, Gray, 9-Speed Automatic,['Bluetooth'],"['Backup Camera', 'Brake Assist', 'Stability Control', 'Blind Spot Monitor', 'Lane Departure Warning', 'Rear Cross Traffic Alert']","$39,488"
689, 2021 Honda CR-V Hybrid EX,9,"Bellevue, WA 98006",4.1, Hybrid,40,35, AWD, 2.0L I4 16V MPFI DOHC Hybrid, Crystal Black Pearl, Black, Automatic CVT,"['Bluetooth', 'Apple CarPlay/Android Auto']","['Backup Camera', 'Brake Assist', 'Stability Control', 'Automatic Emergency Braking', 'Blind Spot Monitor', 'Lane Departure Warning', 'Rear Cross Traffic Alert']","$30,985"
690, 2021 Honda CR-V EX-L,7,"Bellevue, WA 98006",4.1, Gasoline,27,32, AWD, 1.5L I4 16V GDI DOHC Turbo, Radiant Red Metallic, Gray, Automatic CVT,['Bluetooth'],"['Backup Camera', 'Brake Assist', 'Stability Control', 'Automatic Emergency Braking', 'Blind Spot Monitor', 'Lane Departure Warning', 'Rear Cross Traffic Alert']","$33,020"
691, 2019 Subaru Forester Premium,"26,962","Bellevue, WA 98007",4.9, Gasoline,26,33, AWD, 2.5L H4 16V GDI DOHC, Ice Silver Metallic, Black, Automatic CVT,"['Bluetooth', 'Apple CarPlay/Android Auto']","['Backup Camera', 'Brake Assist', 'Stability Control', 'Automatic Emergency Braking', 'Blind Spot Monitor', 'Lane Departure Warning', 'Rear Cross Traffic Alert']","$27,995"
692, 2020 Tesla Model Y Performance,"3,916","Bellevue, WA 98005",4.6, Electric,116,106, AWD, Electric, Red Multi,-1, 1-Speed Automatic,['Bluetooth'],"['Backup Camera', 'Brake Assist', 'Stability Control', 'Lane Departure Warning']","$60,998"
693, 1957 Chevrolet Bel Air RESTO-MOD,"2,087","Bellevue, WA 98005",3.4, Gasoline,-1,-1,-1, 8 Cylinder, Black Cherry, Gray, Automatic,-1,-1,"$79,950"
694, 2020 Ford Shelby GT500 Base,5,"Seattle, WA 98125",4.7, Gasoline,12,18, RWD, 5.2L V8 32V MPFI DOHC Supercharged, Oxford White, Ebony, 7-Speed Automatic with Auto-Shift,"['Bluetooth', 'Premium Sound System', 'Apple CarPlay/Android Auto']","['Backup Camera', 'Brake Assist', 'Stability Control', 'Blind Spot Monitor']","$92,997"
695, 2018 Chevrolet Traverse High Country,"54,652","Seattle, WA 98125",3.6, Gasoline,17,25, AWD, 3.6L V6 24V GDI DOHC, Mosaic Black Metallic, Jet Black, 9-Speed Automatic,"['Bluetooth', 'Premium Sound System', 'Apple CarPlay/Android Auto']","['Brake Assist', 'Stability Control']","$37,995"
696, 2019 Ford Mustang EcoBoost,"11,068","Seattle, WA 98125",4.7, Gasoline,21,31, RWD, 2.3L I4 16V GDI DOHC Turbo, Shadow Black, Ebony, 6-Speed Manual,['Bluetooth'],"['Backup Camera', 'Brake Assist', 'Stability Control']","$25,995"
697, 2013 Acura TSX 2.4,"78,489","Seattle, WA 98109",4.7, Gasoline,22,30, FWD, 2.4L I4 16V MPFI DOHC, Graphite Luster Metallic, Ebony, 5-Speed Automatic,['Bluetooth'],"['Brake Assist', 'Stability Control']","$15,488"
698, 2020 Ford Mustang GT Premium,5,"Seattle, WA 98125",4.7, Gasoline,15,24, RWD, 5.0L V8 32V PDI DOHC, Shadow Black, Ebony, 10-Speed Automatic,"['Bluetooth', 'Premium Sound System', 'Apple CarPlay/Android Auto']","['Backup Camera', 'Brake Assist', 'Stability Control', 'Automatic Emergency Braking', 'Blind Spot Monitor', 'Rear Cross Traffic Alert']","$125,995"
699, 2015 Toyota Avalon Hybrid Limited,"65,438","Seattle, WA 98133",4.4, Hybrid,40,39, FWD, 2.5L I4 16V MPFI DOHC Hybrid, Celestial Silver Metallic, Black, Automatic CVT,"['Bluetooth', 'Premium Sound System']","['Backup Camera', 'Brake Assist', 'Stability Control', 'Blind Spot Monitor', 'Rear Cross Traffic Alert']","$17,980"
700, 2018 Toyota 4Runner SR5,"81,084","Seattle, WA 98133",4.4, Gasoline,17,20, 4WD, 4.0L V6 24V MPFI DOHC, Gray,-1, 5-Speed Automatic,['Bluetooth'],"['Backup Camera', 'Brake Assist', 'Stability Control']","$31,970"
701, 2021 Hyundai Kona EV Ultimate,1,"Seattle, WA 98133",2.5, Electric,132,108, FWD, Electric, Chalk White / Black Roof, Stone Gray, 1-Speed Automatic,"['Bluetooth', 'Premium Sound System', 'Apple CarPlay/Android Auto']","['Backup Camera', 'Brake Assist', 'Stability Control', 'Automatic Emergency Braking', 'Blind Spot Monitor', 'Lane Departure Warning', 'Rear Cross Traffic Alert']","$41,845"
702, 2021 Jeep Grand Cherokee Limited,1,"Seattle, WA 98133",4.4, Gasoline,18,25, 4WD, 3.6L V6 24V MPFI DOHC, Billet Silver Metallic Clearcoat, Black, 8-Speed Automatic,"['Bluetooth', 'Apple CarPlay/Android Auto']","['Backup Camera', 'Brake Assist', 'Stability Control', 'Automatic Emergency Braking', 'Blind Spot Monitor', 'Rear Cross Traffic Alert']","$41,749"
703, 2021 Hyundai Kona EV Ultimate,1,"Seattle, WA 98133",2.5, Electric,132,108, FWD, Electric,-1,-1, 1-Speed Automatic,"['Bluetooth', 'Premium Sound System', 'Apple CarPlay/Android Auto']","['Backup Camera', 'Brake Assist', 'Stability Control', 'Automatic Emergency Braking', 'Blind Spot Monitor', 'Lane Departure Warning', 'Rear Cross Traffic Alert']","$41,495"
704, 2018 Toyota 4Runner SR5,"82,549","Seattle, WA 98133",4.4, Gasoline,17,20, 4WD, 4.0L V6 24V MPFI DOHC, White,-1, 5-Speed Automatic,['Bluetooth'],"['Backup Camera', 'Brake Assist', 'Stability Control']","$31,970"
705, 2020 Hyundai Sonata Hybrid SEL,1,"Seattle, WA 98133",2.5, Hybrid,45,51, FWD, 2.0L I4 16V GDI DOHC Hybrid, Calypso Red, Black, 6-Speed Automatic,"['Bluetooth', 'Premium Sound System', 'Apple CarPlay/Android Auto']","['Backup Camera', 'Brake Assist', 'Stability Control', 'Automatic Emergency Braking', 'Blind Spot Monitor', 'Lane Departure Warning', 'Rear Cross Traffic Alert']","$21,795"
706, 2014 Subaru Outback 2.5i Premium,"90,208","Kirkland, WA 98034",3.4, Gasoline,22,29, AWD, 2.5L H4 DOHC 16V, White, Tan, Automatic,['Bluetooth'],"['Brake Assist', 'Stability Control']","$14,995"
707, 2018 Chevrolet Cruze LT,"40,190","Shoreline, WA 98133",4, Gasoline,29,40, FWD, 1.4L I4 16V GDI DOHC Turbo, Cajun Red Tintcoat, Black, 6-Speed Automatic,"['Bluetooth', 'Apple CarPlay/Android Auto']","['Backup Camera', 'Brake Assist', 'Stability Control']","$13,950"
708, 2019 Mercedes-Benz GLS 450 Base 4MATIC,"11,923","Kirkland, WA 98034",4.5, Gasoline,16,22, AWD, 3.0L V6 24V GDI DOHC Twin Turbo, Iridium Silver Metallic, Black, 9-Speed Automatic,"['Bluetooth', 'Premium Sound System', 'Apple CarPlay/Android Auto']","['Backup Camera', 'Brake Assist', 'Stability Control']","$57,777"
709, 2017 Chevrolet Equinox LS,"77,165","Poulsbo, WA 98370",4.6, Gasoline,21,31, FWD, 2.4L I4 16V GDI DOHC, Black, Jet Black, 6-Speed Automatic,['Bluetooth'],"['Backup Camera', 'Brake Assist', 'Stability Control']","$16,971"
710, 2021 Hyundai Venue SEL,11,"Edmonds, WA 98026",4.7, Gasoline,30,33, FWD, 1.6L I4 16V MPFI DOHC, Intense Blue, Black, Automatic CVT,"['Bluetooth', 'Apple CarPlay/Android Auto']","['Backup Camera', 'Brake Assist', 'Stability Control', 'Automatic Emergency Braking', 'Blind Spot Monitor', 'Lane Departure Warning', 'Rear Cross Traffic Alert']","$17,690"
711, 2020 Mazda CX-5 Grand Touring,"3,856","Edmonds, WA 98026",4.2, Gasoline,24,30, AWD, 2.5L I4 16V GDI DOHC, Machine Gray Metallic, Black, 6-Speed Automatic,"['Bluetooth', 'Premium Sound System']","['Backup Camera', 'Brake Assist', 'Stability Control', 'Blind Spot Monitor', 'Lane Departure Warning', 'Rear Cross Traffic Alert']","$31,268"
712, 2021 Hyundai Elantra SEL,13,"Edmonds, WA 98026",4.7, Gasoline,31,41, FWD, 2.0L I4 16V MPFI DOHC, Quartz White, Black, Automatic CVT,"['Bluetooth', 'Apple CarPlay/Android Auto']","['Backup Camera', 'Brake Assist', 'Stability Control', 'Automatic Emergency Braking', 'Blind Spot Monitor', 'Lane Departure Warning', 'Rear Cross Traffic Alert']","$18,500"
713, 2021 Hyundai Elantra Limited,14,"Edmonds, WA 98026",4.7, Gasoline,31,41, FWD, 2.0L I4 16V MPFI DOHC, Electric Shadow, Black, Automatic CVT,"['Bluetooth', 'Premium Sound System']","['Backup Camera', 'Brake Assist', 'Stability Control', 'Automatic Emergency Braking', 'Blind Spot Monitor', 'Lane Departure Warning']","$21,720"
714, 2021 Hyundai Kona EV SEL,14,"Edmonds, WA 98026",4.7, Electric,132,108, FWD, Electric, Sonic Silver, Black, 1-Speed Automatic,"['Bluetooth', 'Apple CarPlay/Android Auto']","['Backup Camera', 'Brake Assist', 'Stability Control', 'Automatic Emergency Braking', 'Blind Spot Monitor', 'Lane Departure Warning', 'Rear Cross Traffic Alert']","$33,220"
715,Certified 2018 Mercedes-Benz GLE 350 Base 4MATIC,"21,697","Lynnwood, WA 98037",4.6, Gasoline,18,22, AWD, Premium Unleaded V-6 3.5 L/213, Lunar Blue Metallic, Ginger Beige/Espresso, Automatic,-1,-1,"$42,877"
716, 2020 Hyundai Palisade SEL,"5,923","Lynnwood, WA 98037",4.7, Gasoline,19,24, AWD, 3.8L V6 24V GDI DOHC, Silver, Black, 8-Speed Automatic,['Bluetooth'],"['Backup Camera', 'Brake Assist', 'Stability Control', 'Automatic Emergency Braking', 'Lane Departure Warning', 'Rear Cross Traffic Alert']","$46,999"
717, 2013 Ford E350 Super Duty XLT,"73,458","Lynnwood, WA 98087",4.2, Gasoline,11,15, RWD, 5.4L V8 16V MPFI SOHC, Oxford White, Gray, 4-Speed Automatic,-1,['Stability Control'],"$17,999"
718, 2012 Volvo S60 T5,"79,373","Lynnwood, WA 98087",4.8, Gasoline,20,30, FWD, 2.5L I5 20V MPFI DOHC Turbo, Silver, Soft Beige / Off Black, 6-Speed Automatic,"['Bluetooth', 'Premium Sound System']","['Brake Assist', 'Stability Control']","$10,999"
719, 2013 Toyota Corolla LE,"22,279","Everett, WA 98204",4.9, Gasoline,26,34, FWD, 1.8L I4 16V MPFI DOHC, Nautical Blue Metallic, Ash, 4-Speed Automatic,['Bluetooth'],"['Brake Assist', 'Stability Control']","$11,888"
720, 2014 Kia Forte LX,"76,072","Lynnwood, WA 98087",4, Gasoline,25,36, FWD, 1.8L I4 16V MPFI DOHC, Blue, Gray, 6-Speed Automatic,['Bluetooth'],"['Brake Assist', 'Stability Control']","$7,995"
721, 2021 Honda Insight EX,5,"Everett, WA 98204",4, Hybrid,55,49, FWD, 1.5L I4 16V MPFI DOHC Hybrid, Radiant Red Metallic, Ivory, Automatic CVT,"['Bluetooth', 'Apple CarPlay/Android Auto']","['Backup Camera', 'Brake Assist', 'Stability Control', 'Automatic Emergency Braking', 'Blind Spot Monitor', 'Lane Departure Warning', 'Rear Cross Traffic Alert']","$24,716"
722, 2021 Honda Odyssey EX-L,5,"Everett, WA 98204",4, Gasoline,19,28, FWD, 3.5L V6 24V GDI SOHC, Obsidian Blue Pearl, Gray, 10-Speed Automatic,['Bluetooth'],"['Backup Camera', 'Brake Assist', 'Stability Control', 'Blind Spot Monitor', 'Lane Departure Warning', 'Rear Cross Traffic Alert']","$37,096"
723, 2018 Chevrolet Volt LT,"1,037","Tacoma, WA 98409",4.4, Hybrid,-1,-1, FWD, 1.5L I4 16V GDI DOHC Hybrid, Mosaic Black Metallic, Jet Black, 1-Speed Automatic,"['Bluetooth', 'Premium Sound System', 'Apple CarPlay/Android Auto']","['Backup Camera', 'Brake Assist', 'Stability Control']","$23,987"
724, 2021 Chevrolet Bolt EV Premier,2,"Tacoma, WA 98409",4.4, Electric,127,108, FWD, Electric, Slate Gray Metallic, Dark Galvanized Gray, 1-Speed Automatic,"['Bluetooth', 'Premium Sound System', 'Apple CarPlay/Android Auto']","['Backup Camera', 'Brake Assist', 'Stability Control', 'Blind Spot Monitor', 'Rear Cross Traffic Alert']","$33,785"
725, 2010 Toyota Prius III,"109,200","Tacoma, WA 98409",3.3, Hybrid,51,48, FWD, 1.8L I4 16V MPFI DOHC Hybrid, Barcelona Red Metallic, Misty Gray, Automatic CVT,"['Bluetooth', 'Premium Sound System']","['Brake Assist', 'Stability Control']","$9,938"
726,Certified 2020 Toyota Corolla SE,"6,235","Tacoma, WA 98409",4.9, Gasoline,31,40, FWD, 2.0L I4 16V PDI DOHC, Classic Silver Metallic, Black, Automatic CVT,['Bluetooth'],"['Backup Camera', 'Brake Assist', 'Stability Control', 'Automatic Emergency Braking', 'Lane Departure Warning']","$19,999"
727, 2018 Toyota Camry SE,"35,316","Tacoma, WA 98409",4.9, Gasoline,28,39, FWD, 2.5L I4 16V PDI DOHC, Celestial Silver Metallic, Black, 8-Speed Automatic,['Bluetooth'],"['Backup Camera', 'Brake Assist', 'Stability Control', 'Automatic Emergency Braking', 'Lane Departure Warning']","$21,999"
